Title,Content,Category
Дүрт округта үҙҙәрен үҙҙәре күрһәткән кандидаттар еңеүгә өлгәшкән,"Дәүләт Йыйылышы - Ҡоролтай депутаттар һайлау йомғаҡтары буйынса республика Үҙәк һайлау комиссияһы ултырышы үтте.
Башҡортостан Республикаһының етенсе саҡырылыш Дәүләт Йыйылышы – Ҡоролтай депутаттарын һайлау һөҙөмтәләрен Башҡортостандың Үҙәк һайлау комиссияһы рәйесе Илона Макаренко иғлан итте.
Йомғаҡ яһар алдынан комиссия ағзалары Башҡортостандың Үҙәк һайлау комиссияһы рәйесе урынбаҫары Марат Ғәҙеловтың Башҡортостан Республикаһының етенсе саҡырылыш Дәүләт Йыйылышы – Ҡоролтай депутаттарын һайлау буйынса үҙәк һайлау комиссияһына килгән мөрәжәғәттәр тураһында мәғлүмәтен тыңланы һәм иғтибарға алды.
Ултырыштың көн тәртибенең икенсе мәсьәләһе буйынса Башҡортостандың Үҙәк һайлау комиссияһы рәйесе Илона Макаренко сығыш яһаны. Берҙәм республика округы буйынса депутаттар һайлау үткәрелгән һәм ғәмәлдә тип танылды.
Кандидаттар исемлегенең һәр береһе алған һайлаусыларҙың тауыштары түбәндәгесә бүленгән:
Рәсәй Федерацияһының Коммунистар партияһы – 180 696 (11,71 процент);
“Ғәҙел Рәсәй – Патриоттар – Хәҡиҡәт өсөн” социалистик сәйәси партияһы – 114 056 (7,39 процент);
“Яңы кешеләр” сәйәси партияһы – 52 688 (3,41%);
Рәсәйҙең Либераль-демократик партияһы – 119 373 (7,73 процент);
“Берҙәм Рәсәй” Бөтә Рәсәй сәйәси партияһы – 1 063 631 (68,92 процент).
Һөҙөмтәлә берҙәм округ буйынса тауыш биреү һөҙөмтәһендә сәйәси партиялар алған мандаттар һаны:
Рәсәй Федерацияһының Коммунистар партияһы – алты;
“Ғәҙел Рәсәй – Патриоттар – Хәҡиҡәт өсөн” социалистик сәйәси партияһы – дүрт;
Рәсәйҙең Либераль-демократик партияһы – дүрт;
“Берҙәм Рәсәй” Бөтә Рәсәй сәйәси партияһы – 41.
Артабан Илона Макаренко етенсе саҡырылыш Дәүләт Йыйылышы – Ҡоролтайға депутаттар һайлау буйынса һайлау кампанияһының дөйөм йомғаҡтарын иғлан итте. Берҙәм республика округы һәм 55 бер мандатлы округ буйынса депутаттар һайлау үткәрелгән һәм ғәмәлдә тип таныла, 110 депутат һайлана: 55 берҙәм республика округы буйынса, 55 бер мандатлы округтар буйынса.
Бер мандатлы округтар буйынса биш партия вәкилдәре еңеү яулай. Был дүрт Дума партияһы:”Берҙәм Рәсәй” – 46, Рәсәй Федерацияһының Коммунистар партияһы – ике, “Ғәҙел Рәсәй – Патриоттар – Хәҡиҡәт өсөн” социалистик сәйәси партияһы – бер, “Яңы кешеләр” партияһы – бер,  Рәсәй “Йәшелдәр” экологик партияһы – бер. Бынан тыш дүрт округта үҙҙәрен үҙҙәре күрһәткән кандидаттар еңеүгә өлгәшкән.
Мәғлүмәт һәм фото сығанағы: cikrb.ru",Сәйәсәт һәм хоҡуҡ
Хәрбиҙәрҙең пенсияһы һаҡланасаҡ ,"Рәсәй Президенты Владимир Путин махсус хәрби операцияла ҡатнашҡан хәрби пенсионерҙарҙың пенсияһын тулыһынса түләү тураһында указға ҡул ҡуйҙы.
Был указға ярашлы, хәҙер хәрби пенсионерҙар һәм тәртип һаҡлау органдары хеҙмәткәрҙәре махсус хәрби операцияла ҡатнашыу тураһында контракт төҙөһә лә, төп түләүҙәрҙән тыш пенсия аласаҡ. Быға тиклем ташламалы стажы буйынса пенсияға киткән хәрби хеҙмәткәр кире хәрби хеҙмәт буйынса контракт төҙөһә, уның пенсияһы туҡтатыла ине.
Фото: Башҡортостан Башлығының матбуғат хеҙмәте.",Сәйәсәт һәм хоҡуҡ
Егет ике сараны ла иғтибарынан ситтә ҡалдырмаған,"10 сентябрҙә Рәсәйҙә яугир-танкистар һөнәри байрамын билдәләй. Был көндө танкистар сәйәси ваҡиғанан да ситтә ҡалмаған. Мәҫәлән, Әлшәй районының Сураҡай ауылынан Ғәзим Ғаяз улы ике байрамды бер итеп ҡушып, һайлау участкаһына хәрби кейемдә һәм танкистарҙың флагын тотоп килеп, тауыш биргән.
2016-2018 йылдарҙа ул Сыбаркүл ҡалаһында 90-сы танк дивизияһында хеҙмәт итә. Үҙен хөрмәт иткән яугир-танкист булараҡ, ул танк ғәскәрҙәрендә хеҙмәт иткән һәр кем өсөн изге байрамды билдәләп, хеҙмәттәштәрен ҡотлай. Шулай уҡ һайлауҙы ла ҡалдырмай. Йәғни егет ике ҡуяндың ҡойроғон тотҡан.
Автор: Фанүзә Сәләмова, ""Альшеевские вести"" гәзите.",Сәйәсәт һәм хоҡуҡ
"""Барыһына ла рәхмәт!"" ","11 сентябрҙә Башҡортостан Башлығы Радий Хәбиров уҙғарған оператив кәңәшмәлә Берҙәм тауыш биреү көнө йомғаҡтары тикшерелде. Был хаҡта тулыраҡ төбәк Үҙәк һайлау комиссияһы рәйесе Илона Макаренко һөйләне.
10 сентябрҙә республикала Башҡортостан Дәүләт Йыйылышы - Ҡоролтай, шулай уҡ ауыл биләмәләре депутаттарын һайлау уҙҙы, тип хәбәр итте ул. Һайлауға килеү 51,82 процент тәшкил иткән.
Һайлау буйынса бюллетендәрҙең 97 процентын эшкәртеү йомғаҡтары буйынса “Берҙәм Рәсәй” – 68,96 процент, Рәсәй Федерацияһының Коммунистар партияһы – 11,68 процент, Рәсәйҙең Либераль-демократик партияһы – 7,77 процент, “Ғәҙел Рәсәй – дөрөҫлөк өсөн” – 7,35 процент, “Яңы кешеләр” 3,4 процент алды. Бер мандатлы округтар буйынса “Берҙәм Рәсәй” - 46, КПРФ - 2, “Ғәҙел Рәсәй - дөрөҫлөк өсөн” - 1, “Яңы кешеләр” - 1, “Йәшелдәр” - 1 һәм үҙҙәрен үҙҙәре күрһәтеүселәр 4 мандат алды.
Үткән һайлауҙар 2023 йылдың төп сәйәси ваҡиғаһы булды, тип билдәләне Башҡортостан Башлығы.
– Беҙ башҡарырға тейеш беренсе нәмә – ул тауыш биреүҙә ҡатнашҡан Башҡортостан халҡына рәхмәт әйтеү. Шул уҡ ваҡытта беҙ башҡа сәйәси көстәр өсөн тауыш биргән һәр кешегә рәхмәт белдерәбеҙ. Төбәк бүлексәһе секретары булыуымды һәм “Берҙәм Рәсәй”ҙән булыуымды беләһегеҙ. Әммә беҙ һайлауға килгән кешеләргә, уларҙың кемде һайлауына ҡарамаҫтан, рәхмәт белдерәбеҙ. Был бик дөрөҫ.
Икенсеһе. Халыҡтың 50 проценттан ашыуы тауыш бирергә килгән. Ғәҙәттәгесә, электораль традиция буйынса тауыш биреүҙең юғары кимәле ауыл райондарында билдәләнә. Әммә шул уҡ ваҡытта ҙур ҡалалар ҙа әүҙем ҡатнашты тип әйтә алам. Парламентыбыҙҙың йәмғиәтебеҙҙең структураһын мөмкин тиклем сағылдырыуы беҙҙең өсөн бик мөһим, – тине ул.
Радий Фәрит улы һайлау һөҙөмтәләре буйынса ла фекерен әйтте.
– Бында “Берҙәм Рәсәй”ҙең еңеп сығыуы аңлашыла. Кем һәм нисек ҡатнашыуы тураһында фекер йөрөтөү минең эшем түгел. Был эште политологтар башҡарасаҡ. Шуны әйтә алам: “Берҙәм Рәсәй” кешеләр күҙенә ғәҙел ҡарай ала, сөнки ул бөтә ҡатмарлы осорҙа ла кешеләр эргәһендә булды. Улар – “Берҙәм Рәсәй”ҙең ирекмәнлеге, МХО-ла ҡатнашыусыларға ярҙам, коронавирусҡа ҡаршы көрәштә мохтаждарға ярҙам итеү. Был тауыш биреүҙә лә сағылды, – тине ул. – Мин, һис шикһеҙ, һайлау кампанияһында ҡатнашҡан барлыҡ сәйәси көстәргә, сәйәси партияларға рәхмәт белдерәм. Һәр һайлауҙың конфликт һәм ауыр конкуренция булыуына ҡарамаҫтан, барыһы ла аҡыллы ҡараш һәм сәйәси грамоталылыҡ йәһәтенән юғары кимәлдә булыуын күрһәтте. Бының өсөн ҙур рәхмәт.
Радий Фәрит улы белдереүенсә, ул парламентта партияларҙың киң спектры тәҡдим ителеүенә шат.
– Һис шикһеҙ, был Рәсәй Федерацияһында көстәрҙең дөйөм сәйәси ҡуйылышын сағылдыра. Бөтә парламент партиялары ла республиканың Дәүләт Йыйылышы – Ҡоролтайҙа тәҡдим ителгән. Һайланған бөтә депутаттарға ла уңыштар теләйбеҙ. Беҙҙә 50 проценттан ашыуға яңыртылыу хаҡында әйткәйнем инде. Байтаҡ сағыу ҡыҙыҡлы кешеләр барлыҡҡа килде. Яңы саҡырылыш Башҡортостан Республикаһы Ҡоролтайының беренсе ултырышы 2023 йылдың 5 октябрендә була, тигән документҡа ҡул ҡуйҙым, – тине ул.
Етәксе бөтә һайлау комиссиялары системаһына һәм Үҙәк һайлау комиссияһына, уның етәксеһенә, бөтә структураларға, хакимиәт башлыҡтарына рәхмәт әйтте.
Фото: Башҡортостан Башлығы сайты. ",Сәйәсәт һәм хоҡуҡ
" Күпселек тауышты ""Берҙәм Рәсәй"" йыйған","10 сентябрҙә республиканың ижтимағи-сәйәси тормошонда мөһим көн булды – Башҡортостан халҡы Дәүләт Йыйылышы – Ҡоролтайға һәм урындағы үҙидаралыҡтың вәкәләтле органдарына депутаттар һайланы. Берҙәм тауыш биреүҙә республика халҡы әүҙемлек күрһәтте һәм республиканың киләсәге өсөн үҙ өлөшөн индерҙе.
11 сентябрҙә Башҡортостандың Үҙәк һайлау комиссияһы рәйесе Илона Макаренко 2023 йылдың 10 сентябрендә Башҡортостан Республикаһы Дәүләт Йыйылышы-Ҡоролтай депутаттарын һайлауҙа тауыш биреүҙең яҡынса йомғаҡтары менән таныштырҙы.  
– Берҙәм тауыш биреү көнөндә Башҡортостан Республикаһында Башҡортостан Республикаһының етенсе саҡырылыш Дәүләт Йыйылышы – Ҡоролтай депутаттарын һайлау һәм урындағы һайлауҙар үтте, бөтәһе 778 һайлау кампанияһы. Дәүләт Йыйылышы – Ҡоролтайға һайлауҙа кандидаттар биш партиянан сығыш яһаны. Был парламент партиялары: “Берҙәм Рәсәй”, ЛДПР, Рәсәйҙең Либераль-демократик партияһы, “Яңы кешеләр”, Ғәҙел Рәсәй – Патриоттар – Хәҡиҡәт өсөн, Рәсәй Федерацияһының Коммунистар партияһы.
Улар берҙәм округ һәм бер мандатлы округтар буйынса кандидаттар тәҡдим итте. Тағы ла ике кандидат бер мандатлы округтарҙа “Йәшелдәр” Рәсәй экологик партияһы һәм “Родина” партияһынан сығыш яһаны. Дөйөм алғанда, Дәүләт Йыйылышы – Ҡоролтайға һайлауҙа 110 мандатҡа ете партиянан 844 кандидат һәм үҙ-үҙен күрһәтеүсе дәғүә итте. Урындағы үҙидара органдарына һайлауҙарҙа 7 025 мандатҡа 14 меңдән ашыу кандидат теркәлде. Улар биш парламент партияһын, шулай уҡ “Йәшелдәр” Рәсәй экологик партияһын, Пенсионерҙар партияһын, “Граждандар Платформаһы” партияһын күрһәтте. Бөтә кимәлдәге һайлауҙарҙа бөтәһе туғыҙ партия ҡатнашты, – тине Илона Макаренко.
Республика Үҙәк һайлау комиссияһының Мәғлүмәт үҙәге мәғлүмәттәре буйынса, 2023 йылдың 11 сентябрендә иртәнге сәғәт 10-ға ҡарата берҙәм округ буйынса Дәүләт Йыйылышы – Ҡоролтай депутаттарын һайлауҙа протоколдарҙың 94,90 проценты эшкәртелгән. Яҡынса мәғлүмәттәр буйынса, һайлаусыларҙың 52,48 проценты тауыш биреүҙә ҡатнаша. Илона Макаренко әйтеүенсә, етенсе саҡырылыш Дәүләт Йыйылышы – Ҡоролтай депутаттарын һайлауҙа тауыш биреү 49,08 процент тәшкил иткән.
10 сентябргә ҡарата мәғлүмәттәр буйынса иң юғары күрһәткестәр Тәтешле, Благовар, Баҡалы, Балтас, Благовар, Ейәнсура райондарында, Сибай, Стәрлетамаҡ, Салауат, Октябрьский ҡалаларында билдәләнгән. Өфө ҡалаһында һайлаусыларҙың күбеһе Дим һәм Орджоникидзе райондарындағы участкаларҙа булған.
Эшкәртелгән протоколдар һөҙөмтәләре буйынса сәйәси партиялар киҫегендә һайлаусыларҙың тауыштары түбәндәгесә бүленгән:
“Берҙәм Рәсәй” – 69,11 процент, КПРФ – 11,65 процент, ЛДПР – 7,74 прцент, Ғәҙел Рәсәй хәҡиҡәт өсөн – 7, 31 процент,  “Яңы кешеләр” – 3,37 процент.
Тауыш биреү барышын күҙәтеүселәр күҙәтте. Территориаль һәм участка һайлау комиссияларында бөтәһе 14 121 күҙәтеүсе булған, шуларҙың 65-е – территориаль һайлау комиссияһында. Иң күп күҙәтеүселәрҙе сәйәси партиялар тәғәйенләгән – 7 572, йәмәғәт контроле субъекттарынан һайлауҙы – 5 050, кандидаттарҙан  – 1 500 кеше күҙәтеү алып барҙы.
Күҙәтеүселәрҙән тыш, тауыш биреү барышын киң мәғлүмәт саралары вәкилдәре күҙәтә, һайлау участкаларында 75 киң мәғлүмәт сараһы редакцияһынан – 215 кеше.
Һайлау кампанияһының башынан алып бөгөнгө көнгә тиклем Үҙәк һайлау комиссияһының телефон “ҡыҙыу линияһы” эшләй. “Ҡыҙыу линия”ға бөтәһе 321 мөрәжәғәт килгән, шул иҫәптән 280-е – Дәүләт Йыйылышы – Ҡоролтайға һайлау буйынса, 41-е – урындағы үҙидараның вәкиллекле органдарына һайлау буйынса. Берҙәм тауыш биреү көнөндә 95 мөрәжәғәт килгән. Шуларҙың 90-ы – Башҡортостан Республикаһы Дәүләт Йыйылышы – Ҡоролтайға һәм 5-е урындағы үҙидара органдарына һайлауҙарға ҡағыла.
Шылтыратыуҙарҙың төп өлөшө – 88-е һайлау өлкәһендә мәғлүмәт алыуға (һайлауҙар тураһында ҡануниәт нормаларын аңлатыу, һайлауҙар тураһында ҡануниәтте ҡулланыу практикаһына (шул иҫәптән «мобиль һайлаусы» механизмына), белешмә мәғлүмәт алыуға (адрестар, бәйләнештәр, һайлау комиссияларының эш режимы, сайттар буйынса навигация), яҙма мөрәжәғәт тәртибен аңлатыуға ҡағылған. Шулай уҡ һайлау комиссияларының ҡарарҙарына, ғәмәлдәренә (сара күрмәүенә) – дүрт ялыу, һайлаусылар исемлеген төҙөү, һайлауҙарҙы мәғлүмәт менән тәьмин итеү, һайлау ҡануниәтен камиллаштырыу мәсьәләләре буйынса бер  бер ялыу килгән. “Ҡыҙыу линия” 11 һәм 12 сентябрҙә иртәнге сәғәт 10-дан көндөҙгө 14-кә тиклем эшләй.
– Берҙәм округ буйынса һайлауҙарға Башҡортостан Республикаһының Үҙәк һайлау комиссияһы, бер мандатлы округтар буйынса округ һайлау комиссиялары йомғаҡ яһай. Комиссияларҙың йомғаҡлау ултырыштарынан һуң республикабыҙ граждандарының Башҡортостан Республикаһы етенсе саҡырылыш Дәүләт Йыйылышы – Ҡоролтай депутаттары итеп кемде һайлағандары билдәле буласаҡ, – тине Илона Макаренко.
Фото: vk.com/erbashkortostan",Сәйәсәт һәм хоҡуҡ
Беренсе этап еңеүселәре билдәле,"11 октябрҙән  баш ҡаланың Спорт һарайында конькиҙа фигуралы шыуыу буйынса Бөтә Рәсәй “Ростелеком Рәсәйҙең Гран-приһы – Ҡурай иле” тип исемләнгән сара, тағы юниорҙар араһында Бөтә Рәсәй “Ҡурай иле” ярыштары бара.
Ярыштарҙың беренсе этабы тамамланды. Рәсәйҙең Конькиҙа фигуралы шыуыу буйынса федерацияһы генераль президенты Александр Коган һәм Башҡортостандың спорт министры урынбаҫары Артем Новиков призлы урын яулағандарҙы ҡотланы. Ир-егеттәр араһында беренсе урынды – Евгений Семенко, икенсене – Роман Савосин һәм өсөнсөнө Андрей Мозалев яуланы. Ҡатын-ҡыҙҙар араһында беренсе урынға - Аделия Петросян, икенсегә - Анна Фролова, өсөнсөгә Елизавета Куликова сыҡты. Парҙар араһында иң яҡшыһы тип Елизавета Хоҙайбирҙиева менән Егор Базин тип танылды. Икенсе урынды – Ирина Хавронина менән Девид Нарижный, өсөнсөнө Софья Леонтьева менән Даниил Горелкин яуланы.
Фото: БР Спорт министрлығы.",Спорт
Хаҡлы ялдағылар бушлай сәйәхәт итә,"Бына өс йыл инде Башҡортостан Башлығы тәҡдиме менән башланғыс алған “Башҡортостанда оҙон ғүмерлелек. Туризм” проекты уңышлы дауам итә. Яңауыл пенсионерҙары ла был мөмкинлекте ҡулдан ысҡындырмай республика буйынса социаль турҙарға сыға. Ошо ваҡыт эсендә хаҡлы ялдағы 473 кеше 14 турҙа ҡатнашҡан. Һәр сәфәр үҙенсә мауыҡтырғыс, тәьҫораттарға бай, тип яҙа “Яңауыл таңдары”.  
Социаль турҙарҙа ҡатнашыу өсөн  тәүҙә “Башҡортостанда оҙон ғүмерлелек. Туризм” сайтында (""Башкирское долголетие. Туризм"" тип яҙһағыҙ, шунда уҡ килеп сыға) теркәлергә кәрәклеген яңауылдар яҡшы белә. Октябрь башында сираттағы төркөм Өфөгә сәйәхәткә барып ҡайтҡан. Туристар баш ҡаланың иҫтәлекле урындары буйлап ике ҡатлы автобуста сәйәхәт иткән, Милли музейҙа булған, Өфө лимонарийы менән танышҡан.
Оло йәштәгеләрҙе сәфәрҙә оҙатып йөрөгән  район хакимиәтенең баш белгесе Марина Соснина билдәләүенсә, туристар баш ҡала менән танышыуҙан бик ҡәнәғәт ҡалған. Сәйәхәттә ҡатнашыусы Альбина Әүхәҙиева файҙалы проект өсөн Башҡортостан Башлығына һәм турҙы ойоштороусыларға ҙур рәхмәт белдергән: “Экскурсоводтар Эльвира һәм Татьянаға рәхмәтлебеҙ, ҙур ҡыҙыҡһыныу менән уларҙы тыңланыҡ. Автобус водителдәре шау-гөр килеп торған ҡалала беҙҙе тыныс, яҡшы итеп йөрөттө, хәүефләнмәнек тә. Тыуған республикабыҙҙа ниндәй матур иҫтәлектәргә бай урындар бар икән! Программа артабан да эшләһен ине!”
 Альбина Әүхәҙиева фотолары.
 ",Спорт
