Title,Content,Category
Ябай ауыл малайынан – Мәскәү университеты инженерына!,Ябай ауыл малайынан – Мәскәү университеты инженерына!,Йәмғиәт
Милиционер олатайым,Милиционер олатайым,Йәмғиәт
Ҡатын-ҡыҙ – донъя тотҡаһы,Ҡатын-ҡыҙ – донъя тотҡаһы,Йәмғиәт
 Ҡыш бабайға хат яҙырға теләһәң..., Ҡыш бабайға хат яҙырға теләһәң...,Йәмғиәт
"«Аҡса биреп тор әле, күрше»","«Аҡса биреп тор әле, күрше»",Йәмғиәт
Мәктәптә туҡланыу нисек үҙгәргән?,Мәктәптә туҡланыу нисек үҙгәргән?,Йәмғиәт
Эшҡыуарҙарҙың хоҡуғы яҡлана,Эшҡыуарҙарҙың хоҡуғы яҡлана,Йәмғиәт
Асарбаҡтарға һеҙ ҙә  ярҙам итә алаһығыҙ,Асарбаҡтарға һеҙ ҙә  ярҙам итә алаһығыҙ,Йәмғиәт
62 йәшлек ирҙең ҡолағында тараҡан үрсегән,62 йәшлек ирҙең ҡолағында тараҡан үрсегән,Йәмғиәт
Ижади коллективтар ҙа акциянан ситтә ҡалмай,Ижади коллективтар ҙа акциянан ситтә ҡалмай,Йәмғиәт
Көн һайын 345 мең 600 бала ауаз һала,Көн һайын 345 мең 600 бала ауаз һала,Йәмғиәт
Өлгөлө атайҙарға –  лайыҡлы баһа,Өлгөлө атайҙарға –  лайыҡлы баһа,Йәмғиәт
Баҡалылар ҙа үҙ өлөшөн индерә,Баҡалылар ҙа үҙ өлөшөн индерә,Йәмғиәт
«Ҡыуандырабыҙ»,«Ҡыуандырабыҙ»,Йәмғиәт
"Мобилизацияланғандарға, уларҙың ғаиләләренә – өҫтәмә ярҙам саралары","Мобилизацияланғандарға, уларҙың ғаиләләренә – өҫтәмә ярҙам саралары",Йәмғиәт
Көҙгө каникулда Луганск Халыҡ республикаһынан балалар ял итәсәк,Көҙгө каникулда Луганск Халыҡ республикаһынан балалар ял итәсәк,Йәмғиәт
Халыҡтар берҙәмлеге көнө уңайынан флешмобта ҡатнашығыҙ!,Халыҡтар берҙәмлеге көнө уңайынан флешмобта ҡатнашығыҙ!,Йәмғиәт
Ура-а-а! Каникул башлана!,Ура-а-а! Каникул башлана!,Йәмғиәт
«Үҙебеҙҙекеләрҙе ташламайбыҙ»,«Үҙебеҙҙекеләрҙе ташламайбыҙ»,Йәмғиәт
Беҙҙең һигеҙ конкурс проекты призлы урын алған,Беҙҙең һигеҙ конкурс проекты призлы урын алған,Йәмғиәт
Радий Хәбиров Дүртөйлө районында тоҡомсолоҡ заводындағы хәл-торош менән танышты,Башҡортостан етәксеһе Радий Хәбировтың Дүртөйлө районына эш сәфәре саф тоҡомло эре малдарҙы үрсетеүгә һәм юғары продуктлы ауыл хужалығы культураларын үҫтереүгә махсуслашҡан Ленин исемендәге тоҡом малы заводы менән танышыуҙан башланды.,Иҡтисад
"Елкәң иҫән булһа, ҡамыт табыла","Ишембай районы крәҫтиәндәре, бесәнде тамамлап, ураҡҡа төшкән",Иҡтисад
Радий Хәбиров Стәрлетамаҡта «Строймаш» технопаркы предприятиелары менән танышты,"Башҡортостан Башлығы вазифаһын ваҡытлыса башҡарыусы Радий Хәбировтың Стәрлетамаҡҡа эш сәфәре Башҡортостан быяла компанияһының эше менән танышыуҙан башланды. Предприятие 2010 йылда ойошторолған. Компания директоры Василий Космынин һөйләүенсә, уларҙың фирмаһы табаҡ быяланың бөтә төрҙәрен, мебель фабрикалары өсөн көҙгөлө япманы эшкәртеү менән шөғөлләнә, көнкүреш техникаһын етештереүселәр, автомобиль сәнәғәте өсөн деталдәр, архитектура, дизайн өсөн быялалар яһай.",Иҡтисад
Радий Хабиров: Раздельный сбор мусора – это «высший пилотаж» для муниципалитетов," Жителям надо разъяснять плюсы раздельного сбора мусора, и они должны понимать свою выгоду. Об этом врио главы Башкортостана Радий Хабиров сказал во время общения с жителями многоквартирного дома №80 по улице Гоголя в Уфе. По мнению руководителя Башкортостана, раздельный сбор мусора – это своего рода «высший пилотаж» для муниципалитетов.",Иҡтисад
На Всемирной выставке в Индии презентовали торговый и инвестиционный потенциал Башкирии,"Делегация представителей торговых сетей из Башкортостана приняла участие во Всемирной продовольственной выставке IndusFood, которая прошла на днях в Дели. Ее организаторами выступили Совет по содействию торговли Индии, министерства торговли и пищевой промышленности Индии. Выставка свела вместе 500 лучших индийских производителей продовольствия и около 800 международных байеров — представителей оптовых компаний, мировых сетевых супермаркетов, магазинов, предприятий общепита из 80 стран. В их числе на выставке, организованной с целью расширения экспорта продовольствия из Индии, побывало и 70 предпринимателей из России, а представители Башкортостана стали на ней самой крупной региональной делегацией.",Иҡтисад
"Радий Хәбиров: «Кемдең һаулығы өсөн ныҡ кәрәк, тик шулар ғына Ҡырымға барасаҡ»","БР Башлығы вазифаһын ваҡытлыса башҡарыусы Радий Хәбиров социаль селтәрҙәрҙә үҙенең зитына тейгән нәмә менән уртаҡлашты. Ҡырым башлығы Сергей Аксенов Сибай балаларын санаторийға саҡырғандан һуң, кешеләр интернетта кемдәрҙең балалары диңгеҙгә ял итәсәк тип һорау алыу ҡуйғандар.",Иҡтисад
Сибай балалары Ҡырымда бушлай ял итәсәк,"Башҡортостан Башлығы вазифаһын ваҡытлыса башҡарыусы Радий Хәбиров Ҡырым Башлығы Сергей Аксенов менән осрашты. Осрашыу барышында социаль, мәҙәни һәм сауҙа - иҡтисади өлкәлә хеҙмәттәшлек итеү мәсьәләләре тикшерелде. Ике көнлөк эш сәфәрендә Ҡырым етәксеһе Өфөнөң сауҙа һәм социаль объекттары менән таныша.",Иҡтисад
Радий Хабиров заслушал доклады и раздал поручения по смогу в Сибае,"В ходе рабочей поездки в Сибай руководитель Башкирии Радий Хабиров провел заседание Комиссии по чрезвычайным ситуациям (КЧС) в связи с тем, что с ноября прошлого года здесь действует режим повышенной готовности. Из-за окисления руды в неэксплуатируемом карьере по добыче медной руды возникла сильная загазованность воздуха.На заседании создан межведомственный штаб по предотвращению последствий ЧС в Сибае. Его работу возглавит Александр Лапухов — зам руководителя Госкомитета РБ по ЧС.",Иҡтисад
"Р.Хабиров: Мер, предпринимаемых УГОКом в Сибае, — недостаточно"," 15 января в ходе рабочей поездки в Сибай врио главы Башкирии Радий Хабиров жестко раскритиковал руководство УГОКа (Сибайского филиала АО «Учалинский горно-обогатительный комбинат») и руководство города за то, что они не предпринимают должных мер по обеспечению экологического благополучия в городе.",Иҡтисад
Радий Хабиров провел первую в 2019 году встречу с инвесторами,"В Доме республики 10 января врио главы Башкортостана Радий Хабиров провёл первую в 2019 году встречу с инвесторами в формате «Инвестчаса». Состоялось обсуждение четырех инвестиционных проектов.В пресс-службе главы РБ сообщили, что речь шла о создании экспортно ориентированного направления сельхозпредприятия «Шаранагрогаз». По словам инициатора проекта Мансура Латыпова, предполагается развитие уже существующего производства за счёт увеличения посевных площадей, внедрения полной переработки сырья и обеспечения устойчивого сбыта. Продукцию переработки зерна предполагается направлять партнерам из китайской провинции Чунцин, а мясное сырье – на перерабатывающее предприятие в Уфимском районе. Общий объём инвестиций составит 225 млн рублей.",Иҡтисад
Башҡортостан етәксеһе Радий Хәбиров: «Салауат Юлаев» — беҙҙең өсөн бик мөһим,"10 ғинуарҙа Республика йортонда БР Башлығы вазифаһын ваҡытлыса башҡарыусы Радий Хәбиров ""Салауат Юлаев"" хоккей командаһы етәкселеге, баш тренер Николай Цулыгин һәм капитан Григорий панин менән осрашты. Төбәк башлығы хоккейға һәм башҡа спорт төрҙәренә үҙенең мөнәсәбәтен белдерҙе.",Иҡтисад
Радий Хәбиров республиканың православие христиандарын Раштыуа менән ҡотланы,БР Башлығы сайтында ошолай тиелә:,Иҡтисад
Радий Хабиров поздравил жителей Башкортостана вместе с детьми из социального приюта,"Новогоднее поздравление руководителя Башкортостана Радия Хабирова жителям республики получилось эмоциональным по содержанию и необычным по форме, подаче и месту, откуда оно прозвучало.",Иҡтисад
Владимир Путин поздравил Радия Хабирова с Новым годом,«Уважаемый Радий Фаритович!Поздравляю Вас с Новым годом.,Иҡтисад
Радий Хабиров: В Башкирии мы установили самую низкую оплату за сбор мусора в ПФО,Рабочая поездка врио главы Башкортостана Радия Хабирова по Ермекеевскому району началась в селе Спартак.,Иҡтисад
Магнитогорск агломерацияһына инделәр,"БР Иҡтисади үҫеш министрлығы хәбәр итеүенсә, Әбйәлил, Баймаҡ, Белорет һәм Учалы райондары һәм Сибай ҡалаһы Магнитогорск төбәк-ара агломерцияһына индерелгән. ",Иҡтисад
Торатау мәсьәләһенә нөктә ҡуйылды: изге тауға теймәйәсәктәр,"Башҡортостан Хөкүмәтенән хәбәр итеүҙәренсә, ""Башкирская содовая компания"" өсөн сеймал базаһы итеп Ҡуштау тауы һайланған.Торатау менән Йөрәктауға теймәйәсәктәр, Ҡуштауҙы үҙләштергәндә тирә-яҡғты тергеҙеп, тәртипкә ҡалдыу - рекультивация ла барасаҡ. Унда булған туристик объекттар - тау саңғыһы базаһы һәм йәйәүле маршруттар әлегә торасаҡ, 30 йыл дауамында тейелмәйәсәк.",Иҡтисад
Радий Хәбиров Рәсәй юридик форумында конституцияны үҙгәртмәйәсәген белдерҙе,"1 декабрҙә Өфөлә Башҡортостан Башлығы вазифаһын ваҡытлыса башҡарыусы Радий Хәбиров Юристар көнөнә һәм Рәсәй Федерацияһы Конституцияһының 25 йыллығы уңайынан «XXI быуатта конституционализм» Рәсәй юридик форумының пленар ултырышында ҡатнашты. Ул дәүләт власы һәм гражданлыҡ йәмғиәте диалогында кеше хоҡуҡтарына арналды.    – Бындай майҙансыҡтар бик әһәмиәтле. Улар ғалимдарға аралашыу, тәжрибә уртаҡлашыу мөмкинлеге бирә. Кешелек донъяһы бик етеҙ, заманса һәм көнәркәшле. Шуға күрә бер-береңде тыңлау һәм бер аҙ алға киткәндәрҙең тәжрибәһен үҙләштереү мөмкинлеге булыуы бик шәп, – тине Радий Хәбиров.",Иҡтисад
Сәскә ултыртып өлгөрмәһәгеҙ," Былтыр көҙ танышым биргән лилиә сәскәләрен ваҡытында ултыртып өлгөрмәнем. Шуға торттың пластик ҡапҡасына тупраҡ һалып, йылытылған соланға ултыртып ҡуйҙым. Сәскәләрем ҡыш буйына тамырҙарын үҫтерҙе. Ара-тирә аҙ ғына тупраҡты дымландырып торҙом. Мартта улар буйға үҫеп китте. Май аҙағында тышҡа сығарып ултырттым. Барыһы ла сәскә атты. Күршемдең көҙ ултыртып ҡалдырған минеке кеүек лилиәләренең ботаҡтары бәләкәй, сәскә атманы. Сәскә үҫтерергә яратҡан хужабикәләргә минең тәжрибә файҙалы булыр.З. НӘҒИМОВА.Ҡырмыҫҡалы районы. ",Иҡтисад
Радий Хабиров провёл оперативное совещание,"Подводя итоги прошлой недели, Радий Хабиров напомнил, что рассмотренные на заседании президиума Госсовета стратегические задачи развития страны должны быть максимально полно реализованы на региональном уровне в соответствии с объёмом финансирования, предоставляемым федеральным центром.",Иҡтисад
Йәберләүҙәрҙең иң яҡын кешеләреңдән булыуы икеләтә ауыр,"Башҡорт дәүләт академия драма театры яңы ижад миҙгелен Заһиҙә Мусинаның повесы буйынса ҡуйылған “Килен” спектакле менән асты. Был спектакль тамашасыны битараф ҡалдырманы. Социаль селтәрҙә лә ошо хаҡта фекерҙәр күп яҙылды. “Берҙәм Рәсәй” партияһының Төбәк башҡарма комитеты етәксеһе урынбаҫары - партия төҙөлөшө бүлеге начальнигы Гөлнара Кирәева ла тәьҫораттары менән уртаҡлашты.
“Яңы миҙгелде премьералар менән асыу матур йолаға әүерелеүе шатлыҡлы күренеш.  Заһиҙәнең ""Килен"" китабын йәй көнө үк алып уҡығайным, спектакле була тигәс, алдан билеттар алып ҡуйҙыҡ. Былай ҙа ауыр яҙмышлы йәш ҡыҙҙың ҡатын-ҡыҙ бәхете, матур ғаилә ҡорорға тигән эскерһеҙ ынтылыштары ике ғаиләлә лә төп урында булған йәбер-золом менән бәрелешә. Йәберләүҙәрҙең иң яҡын кешеләреңдән булыуы икеләтә ауыр. Ике әсәйҙең дә балаларының бәхетен бер яҡлы ғына аңлауҙары, уларҙың фекерҙәре, уй-теләктәре менән бөтөнләй ҙә һанлашмауы, көн һайын физик һәм мораль йәберләүҙәре ғаилә трагедияһына килтерә. ...Спектакль аҙағына тиклем бөтә залды көсөргәнешлектә тотто. Шул тиклем бирелеп китеп ҡаранык, хатта ҡәйнә кешенең тағы ла балаларына аҡыл өйрәтә башлауын күреп, залдан бер тамашасы апайҙың түҙмәй ""ҠЫҪЫЛМА!!! "" тип ҡысҡырыуы, артистарҙың эшенә лә, режиссерға ла зур баһа булғандыр, тип уйлайым. Барыһын да һөйләп бөтмәйем, үҙегеҙ мотлаҡ барып ҡарағыҙ. Театрҙың тағы ла бер яғы - күптән күрешмәгән, сәнғәткә ғашиҡ кешеләр менән осрашыу һәм аралашыу урыны булыуы. Һәр саҡ ихлас күрешеп, һөйләшеп, ял итеп ҡайтабыҙ, рәхмәт”, – тип яҙҙы Гөлнара Әнүәр ҡыҙы.
Ә һеҙгә ""Килен"" оҡшанымы?
Фото авторы: Руслан Юлтаев.",мәҙәниәт
Айҙар Ғәлимовтың күптәнге хыялы тормошҡа ашҡан,"Башҡортостандың халыҡ артисы Айҙар Ғәлимов октябрҙең башында ял итергә тип Дағстанға юлланған. Был сәфәренең сәбәбе тураһында социаль селтәрҙәге сәхифәһендә уртаҡлашты.
“Ҡояшлы, таулы, диңгеҙле Дағстан иле, бик шатмын һинең мелән яҡындан танышыуыма! Бик күп милләтле халыҡ үҙ тарихын, динен, ә иң мөһиме - рухын һаҡлап ҡала алған тип күрҙем... Был ерҙең киләсәге матур булырға оҡшаған - өмөттәрегеҙ аҡланһын ине... Күптәнге хыялым да тормошҡа ашты – ҡумыҡ дуҫымдың тыуған ауылына барҙым, иҫ киткес хәтирәләр! Миңә ҡалһа, иң матур осрашыуҙар алда ла көтөп тора әле. Дағстан – һин минең йөрәгемдә инде!” – тип яҙған ул.
Бер күрешеү – үҙе бер ғүмер, тиҙәр. Ысынлап та, сәйәхәттәр, аралашыуҙар, дуҫ-туғандар менән осрашыуҙар рухи донъябыҙҙы байыта, яңы ҡанаттар ҡуя.
Һеҙ быйыл ҡайҙа сәйәхәт ҡылдығыҙ? Дағстанды күргәнегеҙ бармы?  
Фото: vk.com/aidar.galimov",мәҙәниәт
